{
  "slug": "costo-chilometrico-camion",
  "kind": "calculator",
  "locale": "it",
  "title": "Costo km camion: calcolatore gratuito per una tratta",
  "description": "Calcola costo totale, costo per km percorso e costo per km carico con carburante, pedaggi, autista, usura, costi fissi e ritorno a vuoto.",
  "eyebrow": "Calcolatore costo per km",
  "published": "2026-08-01",
  "modified": "2026-09-19",
  "reviewed": "2026-09-19",
  "primaryKeyword": "costo km camion",
  "searchIntent": "transactional-informational",
  "topics": [
    "costo per chilometro",
    "costi fissi camion",
    "carburante",
    "costo autista"
  ],
  "related": [
    "guide:costo-chilometrico-camion",
    "guide:calcolo-pedaggio-camion",
    "guide:costo-furgone-per-km",
    "guide:costi-fissi-variabili-autotrasporto",
    "guide:costo-assicurazione-camion",
    "guide:costo-leasing-camion",
    "guide:calcolo-costo-trasporto",
    "calcolatori:costo-carburante-viaggio",
    "calcolatori:fuel-surcharge-autotrasporto",
    "calcolatori:prezzo-minimo-margine-tratta",
    "landing:app-per-autotrasportatori"
  ],
  "pillar": "guide:calcolo-costo-trasporto",
  "calculatorId": "cost-per-km",
  "conversionIntent": "complete-trip",
  "translationGroup": "calculator-cost-per-km-truck",
  "sources": [
    {
      "label": "Commissione europea — Weekly Oil Bulletin",
      "url": "https://energy.ec.europa.eu/data-and-analysis/weekly-oil-bulletin_en"
    },
    {
      "label": "Commissione europea — Road charging",
      "url": "https://transport.ec.europa.eu/transport-modes/road/road-charging_en"
    },
    {
      "label": "MIT — Valori indicativi dei costi di esercizio, marzo 2026",
      "url": "https://www.mit.gov.it/documentazione/valori-indicativi-di-riferimento-dei-costi-di-esercizio-dellimpresa-italiana-di-6"
    },
    {
      "label": "Apple App Store Italia — RouteBudget",
      "url": "https://apps.apple.com/it/app/routebudget/id6789717191",
      "publishedOrUpdated": "Scheda pubblica consultata il 2026-09-07; versione installata da verificare sul dispositivo",
      "geography": "Italia",
      "accessedAt": "2026-09-07",
      "supports": "Funzioni generali dichiarate di calcolo costi, scenari, Archivio e PDF. Il campione PDF separato documenta il template sorgente datato, non ogni versione corrente."
    }
  ],
  "status": "published",
  "author": "Eng. Mostafa",
  "reviewer": "Eng. Mostafa",
  "secondaryKeywords": [
    "calcolatore costo chilometrico camion",
    "costo camion al km",
    "costo autotrasporto al km"
  ],
  "cluster": "costi-autotrasporto",
  "relatedCalculator": "calcolatori:costo-carburante-viaggio",
  "appFeature": "cost-breakdown",
  "canonical": "/it/calcolatori/costo-chilometrico-camion/",
  "ogImage": "/og-cover.jpg",
  "noindex": false,
  "changeSummary": "Ridotte sezioni ripetitive e aggiunto scenario prudente ricalcolabile: confronto dei costi con offerta ipotetica, distinta da tariffe e casi reali."
}
