{
  "slug": "ritorno-a-vuoto-autotrasporto",
  "kind": "guide",
  "locale": "it",
  "status": "published",
  "title": "Ritorno a vuoto nell’autotrasporto: costi e prezzo della tratta",
  "description": "Metodo pratico per conteggiare chilometri, tempo, pedaggi e usura del ritorno a vuoto senza nascondere ipotesi o confonderli con ricavi certi.",
  "eyebrow": "Economia del ritorno",
  "published": "2026-08-01",
  "modified": "2026-08-01",
  "reviewed": "2026-08-01",
  "author": "Eng. Mostafa",
  "reviewer": "Eng. Mostafa",
  "primaryKeyword": "ritorno a vuoto autotrasporto",
  "secondaryKeywords": [
    "costo viaggio camion a vuoto",
    "chilometri a vuoto autotrasporto",
    "calcolo costo tratta camion",
    "prezzo trasporto andata e ritorno"
  ],
  "searchIntent": "informational-commercial",
  "conversionIntent": "protect-margin",
  "translationGroup": "empty-return-road-haulage",
  "cluster": "costo-trasporto",
  "pillar": "guide:calcolo-costo-trasporto",
  "related": [
    "guide:calcolo-costo-trasporto",
    "guide:costo-chilometrico-camion",
    "guide:proteggere-margine-tratta",
    "calcolatori:costo-chilometrico-camion",
    "calcolatori:costo-carburante-viaggio"
  ],
  "relatedCalculator": "calcolatori:costo-chilometrico-camion",
  "calculatorId": null,
  "appFeature": "cost-breakdown",
  "canonical": "/it/guide/ritorno-a-vuoto-autotrasporto/",
  "ogImage": "/og-cover.jpg",
  "noindex": false,
  "topics": [
    "ritorno a vuoto",
    "costo di tratta",
    "chilometri totali",
    "margine autotrasporto"
  ],
  "sources": [
    {
      "label": "Eurostat — Road freight transport by journey characteristics",
      "url": "https://ec.europa.eu/eurostat/statistics-explained/index.php?title=Road_freight_transport_by_journey_characteristics",
      "publishedOrUpdated": "Dati di riferimento 2024; pagina live consultata il 2026-08-01",
      "geography": "Unione europea",
      "accessedAt": "2026-08-01",
      "supports": "Contesto statistico ufficiale sui chilometri percorsi a vuoto; non fornisce una tariffa per singola impresa."
    },
    {
      "label": "Commissione europea — Weekly Oil Bulletin",
      "url": "https://energy.ec.europa.eu/data-and-analysis/weekly-oil-bulletin_en",
      "publishedOrUpdated": "Ultimi file pubblicati il 2026-07-30",
      "geography": "Unione europea",
      "accessedAt": "2026-08-01",
      "supports": "Necessità di usare un prezzo carburante aggiornato e coerente con paese e trattamento fiscale."
    },
    {
      "label": "Commissione europea — Road charging",
      "url": "https://transport.ec.europa.eu/transport-modes/road/road-charging_en",
      "publishedOrUpdated": "Pagina live; documenti informativi aggiornati il 2026-01-26",
      "geography": "Unione europea",
      "accessedAt": "2026-08-01",
      "supports": "I pedaggi dipendono da distanza e tipo di veicolo e devono essere verificati per l’itinerario applicabile."
    }
  ],
  "changeSummary": "Prima pubblicazione: metodo separato per costo del ritorno a vuoto, esempio trasparente, limiti e checklist."
}
