{
  "slug": "calcolare-carburante-pedaggi-autista",
  "kind": "guide",
  "locale": "it",
  "title": "Carburante, pedaggi e autista: controllo dei costi diretti",
  "description": "Un controllo per allineare distanza, pedaggi e durata operativa prima di sommare carburante e costo autista nella stessa tratta.",
  "eyebrow": "Controllo dei costi diretti",
  "published": "2026-08-01",
  "modified": "2026-08-12",
  "reviewed": "2026-08-12",
  "primaryKeyword": "controllo costi diretti tratta camion",
  "searchIntent": "informational",
  "topics": [
    "carburante",
    "pedaggi",
    "costo autista",
    "costo di tratta"
  ],
  "related": [
    "guide:calcolo-costo-trasporto",
    "guide:tempi-guida-riposo-camion",
    "guide:costo-orario-autista-camion",
    "guide:tempi-attesa-carico-scarico-autotrasporto",
    "calcolatori:costo-carburante-viaggio"
  ],
  "calculatorId": null,
  "pillar": "guide:calcolo-costo-trasporto",
  "conversionIntent": "complete-trip",
  "translationGroup": "calcolare-carburante-pedaggi-autista",
  "sources": [
    {
      "label": "Commissione europea — Weekly Oil Bulletin",
      "url": "https://energy.ec.europa.eu/data-and-analysis/weekly-oil-bulletin_en"
    },
    {
      "label": "Commissione europea — Road charging",
      "url": "https://transport.ec.europa.eu/transport-modes/road/road-charging_en"
    },
    {
      "label": "EUR-Lex — Regolamento (CE) n. 561/2006 sui tempi di guida e riposo",
      "url": "https://eur-lex.europa.eu/legal-content/IT/TXT/?uri=CELEX:02006R0561-20241231"
    }
  ],
  "status": "published",
  "author": "Eng. Mostafa",
  "reviewer": "Eng. Mostafa",
  "secondaryKeywords": [
    "costo carburante camion",
    "pedaggio autostradale camion",
    "costo autista per viaggio"
  ],
  "cluster": "costo-trasporto",
  "relatedCalculator": "calcolatori:costo-carburante-viaggio",
  "appFeature": "complete-route-calculation",
  "canonical": "/it/guide/calcolare-carburante-pedaggi-autista/",
  "ogImage": "/og-cover.jpg",
  "noindex": false,
  "changeSummary": "Aggiunti percorsi verso durata operativa, costo orario dell’autista e attese, lasciando questa guida come controllo d’integrazione delle voci dirette."
}
