{
  "slug": "costi-autotrasporto",
  "kind": "pillar",
  "locale": "it",
  "title": "Costi dell’autotrasporto merci: voci fisse, variabili e indirette",
  "description": "Mappa pratica dei costi dell’autotrasporto merci: voci fisse, variabili e indirette, costo per km, dati da aggiornare ed esempio mensile.",
  "eyebrow": "Economia dell’autotrasporto",
  "published": "2026-08-01",
  "modified": "2026-09-02",
  "reviewed": "2026-09-02",
  "primaryKeyword": "costi autotrasporto",
  "searchIntent": "informational",
  "topics": [
    "costi fissi",
    "costi variabili",
    "costo chilometrico",
    "gestione flotta"
  ],
  "related": [
    "guide:calcolo-costo-trasporto",
    "guide:preventivo-trasporto",
    "guide:costi-fissi-variabili-autotrasporto",
    "guide:costo-chilometrico-camion",
    "guide:costo-furgone-per-km",
    "guide:tachigrafo-furgoni-2026",
    "guide:tabelle-costi-autotrasporto-mit-2026",
    "guide:costo-assicurazione-camion",
    "guide:costo-leasing-camion",
    "guide:consumo-adblue-camion",
    "guide:costo-orario-autista-camion",
    "guide:tempi-attesa-carico-scarico-autotrasporto",
    "guide:usura-manutenzione-camion",
    "guide:proteggere-margine-tratta",
    "guide:errori-calcolo-tariffa-trasporto",
    "calcolatori:costo-chilometrico-camion",
    "calcolatori:fuel-surcharge-autotrasporto",
    "calcolatori:quanto-costa-ricaricare-furgone-elettrico",
    "landing:app-per-autotrasportatori"
  ],
  "pillar": null,
  "calculatorId": null,
  "conversionIntent": "protect-margin",
  "translationGroup": "costi-autotrasporto",
  "sources": [
    {
      "label": "Commissione europea — Weekly Oil Bulletin",
      "url": "https://energy.ec.europa.eu/data-and-analysis/weekly-oil-bulletin_en"
    },
    {
      "label": "Commissione europea — Road charging",
      "url": "https://transport.ec.europa.eu/transport-modes/road/road-charging_en"
    },
    {
      "label": "EUR-Lex — Regolamento (CE) n. 561/2006 sui tempi di guida e riposo",
      "url": "https://eur-lex.europa.eu/legal-content/IT/TXT/?uri=CELEX:02006R0561-20241231"
    },
    {
      "label": "MIT — Valori indicativi dei costi di esercizio, marzo 2026",
      "url": "https://www.mit.gov.it/documentazione/valori-indicativi-di-riferimento-dei-costi-di-esercizio-dellimpresa-italiana-di-6"
    }
  ],
  "status": "published",
  "author": "Eng. Mostafa",
  "reviewer": "Eng. Mostafa",
  "secondaryKeywords": [
    "costi fissi autotrasporto",
    "costi variabili autotrasporto",
    "costo autotrasporto merci"
  ],
  "cluster": "costi-autotrasporto",
  "relatedCalculator": "calcolatori:costo-chilometrico-camion",
  "appFeature": "cost-breakdown",
  "canonical": "/it/guide/costi-autotrasporto/",
  "ogImage": "/og-cover.jpg",
  "noindex": false,
  "changeSummary": "Rafforzata la mappa dei costi con percorsi contestuali verso assicurazione, leasing e AdBlue, mantenendo separati costi fissi, consumo e doppio conteggio."
}
