{
  "slug": "app-per-autotrasportatori",
  "kind": "landing",
  "locale": "it",
  "status": "published",
  "title": "App per autotrasportatori: calcola costi, prezzo e preventivo",
  "description": "RouteBudget riunisce costi di tratta, tre scenari di prezzo, archivio locale e riepilogo PDF per autotrasportatori e piccole imprese.",
  "eyebrow": "RouteBudget per il lavoro quotidiano",
  "published": "2026-08-01",
  "modified": "2026-09-07",
  "reviewed": "2026-09-07",
  "author": "Eng. Mostafa",
  "reviewer": "Eng. Mostafa",
  "primaryKeyword": "app per autotrasportatori",
  "secondaryKeywords": [
    "app calcolo costi trasporto",
    "app preventivo camion",
    "calcolo margine autotrasporto",
    "software costo tratta camion",
    "software per autotrasportatori",
    "app per padroncini",
    "app calcolo costi furgone N1"
  ],
  "searchIntent": "commercial-transactional",
  "conversionIntent": "complete-trip",
  "translationGroup": "app-for-road-hauliers",
  "cluster": "prodotto-routebudget",
  "pillar": null,
  "related": [
    "guide:calcolo-costo-trasporto",
    "guide:costo-furgone-per-km",
    "guide:quanto-consuma-un-furgone",
    "guide:costo-autostrada-furgone",
    "guide:preventivo-trasporto",
    "calcolatori:costo-chilometrico-camion"
  ],
  "relatedCalculator": "calcolatori:costo-chilometrico-camion",
  "calculatorId": null,
  "appFeature": "complete-route-calculation",
  "canonical": "/it/app-per-autotrasportatori/",
  "ogImage": "/og-cover.jpg",
  "noindex": false,
  "topics": [
    "app autotrasporto",
    "costo di tratta",
    "scenari di prezzo",
    "preventivo PDF",
    "veicoli N1"
  ],
  "sources": [
    {
      "label": "Google Play — RouteBudget EU",
      "url": "https://play.google.com/store/apps/details?id=eu.routebudget.app",
      "publishedOrUpdated": "Scheda live consultata il 2026-08-01",
      "geography": "Disponibilità secondo paese o area dello store",
      "accessedAt": "2026-08-01",
      "supports": "Destinazione ufficiale Android del prodotto RouteBudget EU."
    },
    {
      "label": "Apple App Store Italia — RouteBudget",
      "url": "https://apps.apple.com/it/app/routebudget/id6789717191",
      "publishedOrUpdated": "Scheda pubblica consultata il 2026-09-07; versione installata da verificare sul dispositivo",
      "geography": "Italia",
      "accessedAt": "2026-09-07",
      "supports": "Funzioni generali dichiarate di calcolo costi, scenari, Archivio e PDF. Il campione PDF separato documenta il template sorgente datato, non ogni versione corrente."
    }
  ],
  "changeSummary": "Chiarita la scelta dell’app dal punto di vista del trasportatore: percorso verso esempio PDF verificabile, schermate e controllo del costo; nessuna promessa di ricerca carichi o gestione flotta."
}
