{
  "slug": "proteggere-margine-tratta",
  "kind": "guide",
  "locale": "it",
  "title": "Analisi di sensibilità del margine per una tratta camion",
  "description": "Come stressare una stima di tratta variando carburante, attese, itinerario e ritorno a vuoto per capire quanto margine resta.",
  "eyebrow": "Stress test della tratta",
  "published": "2026-08-01",
  "modified": "2026-08-23",
  "reviewed": "2026-08-23",
  "primaryKeyword": "analisi sensibilità margine tratta",
  "searchIntent": "informational-commercial",
  "topics": [
    "margine",
    "punto di pareggio",
    "scenari di prezzo",
    "rischio operativo"
  ],
  "related": [
    "guide:calcolo-costo-trasporto",
    "guide:preventivo-trasporto",
    "guide:tariffe-trazionisti",
    "guide:errori-calcolo-tariffa-trasporto",
    "calcolatori:prezzo-minimo-margine-tratta"
  ],
  "calculatorId": null,
  "pillar": "guide:calcolo-costo-trasporto",
  "conversionIntent": "protect-margin",
  "translationGroup": "proteggere-margine-tratta",
  "sources": [
    {
      "label": "MIT — Valori indicativi dei costi di esercizio, marzo 2026",
      "url": "https://www.mit.gov.it/documentazione/valori-indicativi-di-riferimento-dei-costi-di-esercizio-dellimpresa-italiana-di-6",
      "publishedOrUpdated": "Aggiornamento del 17 marzo 2026",
      "geography": "Italia",
      "accessedAt": "2026-08-23",
      "supports": "Famiglie di costo e natura indicativa dei riferimenti per l'impresa italiana; le tabelle non costituiscono una tariffa universale per la singola tratta."
    }
  ],
  "status": "published",
  "author": "Eng. Mostafa",
  "reviewer": "Eng. Mostafa",
  "secondaryKeywords": [
    "margine trasporto",
    "stress test costo tratta",
    "margine residuo trasporto"
  ],
  "cluster": "margini-e-tariffe",
  "relatedCalculator": "calcolatori:prezzo-minimo-margine-tratta",
  "appFeature": "cost-scenarios",
  "canonical": "/it/guide/proteggere-margine-tratta/",
  "ogImage": "/og-cover.jpg",
  "noindex": false,
  "changeSummary": "Ristretta la guida all'analisi di sensibilità e al margine residuo; formula, soglia di copertura e prezzo da margine target appartengono al calcolatore dedicato."
}
