{
  "slug": "preventivo-trasporto",
  "kind": "pillar",
  "locale": "it",
  "title": "Preventivo trasporto per autotrasportatori: costo e offerta",
  "description": "Come trasformare il costo di una tratta in un’offerta di trasporto merci chiara, con prezzo, inclusioni, esclusioni, validità e PDF verificato.",
  "eyebrow": "Guida al preventivo",
  "published": "2026-08-01",
  "modified": "2026-09-06",
  "reviewed": "2026-09-06",
  "primaryKeyword": "preventivo trasporto",
  "searchIntent": "informational-commercial",
  "topics": [
    "preventivo PDF",
    "tariffa di trasporto",
    "offerta cliente",
    "margine di tratta"
  ],
  "related": [
    "guide:calcolo-costo-trasporto",
    "guide:costi-autotrasporto",
    "guide:proteggere-margine-tratta",
    "guide:errori-calcolo-tariffa-trasporto",
    "guide:preventivo-trasporto-pdf",
    "guide:tempi-attesa-carico-scarico-autotrasporto",
    "guide:tariffe-trazionisti",
    "guide:calcolare-carburante-pedaggi-autista",
    "guide:costo-traghetto-camion-sardegna",
    "guide:costo-traghetto-camion-sicilia",
    "guide:clausola-adeguamento-carburante-autotrasporto",
    "calcolatori:costo-chilometrico-camion",
    "calcolatori:costo-carburante-viaggio",
    "calcolatori:fuel-surcharge-autotrasporto",
    "landing:app-per-autotrasportatori"
  ],
  "pillar": null,
  "calculatorId": null,
  "conversionIntent": "pdf-quote",
  "translationGroup": "preventivo-trasporto",
  "sources": [
    {
      "label": "Apple App Store — RouteBudget: Truck Toll Cost",
      "url": "https://apps.apple.com/app/id6789717191",
      "publishedOrUpdated": "Scheda live consultata il 2026-08-08",
      "geography": "Disponibilità secondo paese o area dello store",
      "accessedAt": "2026-08-08",
      "supports": "Descrizione ufficiale delle funzioni di stima, scenari, archivio, PDF e logo aziendale."
    },
    {
      "label": "Google Play — RouteBudget EU",
      "url": "https://play.google.com/store/apps/details?id=eu.routebudget.app",
      "publishedOrUpdated": "Scheda live consultata il 2026-08-08",
      "geography": "Disponibilità secondo paese o area dello store",
      "accessedAt": "2026-08-08",
      "supports": "Destinazione ufficiale Android e disponibilità del prodotto RouteBudget EU."
    }
  ],
  "status": "published",
  "author": "Eng. Mostafa",
  "reviewer": "Eng. Mostafa",
  "secondaryKeywords": [
    "preventivo trasporto merci",
    "calcolo preventivo trasporto",
    "preventivo trasporti",
    "offerta di trasporto"
  ],
  "cluster": "preventivi-trasporto",
  "relatedCalculator": "calcolatori:costo-chilometrico-camion",
  "appFeature": "pdf-quote",
  "canonical": "/it/guide/preventivo-trasporto/",
  "ogImage": "/og-cover.jpg",
  "noindex": false,
  "changeSummary": "Aggiornamento dei soli collegamenti contestuali alle nuove guide operative; metodo e confini delle funzioni invariati."
}
