{
  "slug": "costo-carburante-viaggio",
  "kind": "calculator",
  "locale": "it",
  "title": "Calcolatore carburante camion: litri e costo della tratta",
  "description": "Inserisci distanza, consumo già noto e prezzo al litro per calcolare litri e costo carburante di andata e ritorno a vuoto.",
  "eyebrow": "Calcolatore carburante viaggio",
  "published": "2026-08-01",
  "modified": "2026-09-19",
  "reviewed": "2026-09-19",
  "primaryKeyword": "calcolatore costo carburante viaggio",
  "searchIntent": "transactional-informational",
  "topics": [
    "carburante camion",
    "consumo per tratta",
    "ritorno a vuoto",
    "costo viaggio"
  ],
  "related": [
    "guide:calcolare-carburante-pedaggi-autista",
    "guide:quanto-consuma-un-camion",
    "guide:calcolo-costo-trasporto",
    "guide:proteggere-margine-tratta",
    "calcolatori:costo-chilometrico-camion",
    "calcolatori:fuel-surcharge-autotrasporto"
  ],
  "pillar": "guide:calcolo-costo-trasporto",
  "calculatorId": "fuel-trip",
  "conversionIntent": "add-trip-costs",
  "translationGroup": "calculator-fuel-cost-trip",
  "sources": [
    {
      "label": "Commissione europea — Weekly Oil Bulletin",
      "url": "https://energy.ec.europa.eu/data-and-analysis/weekly-oil-bulletin_en"
    },
    {
      "label": "MASE — Prezzi mensili dei carburanti",
      "url": "https://sisen.mase.gov.it/dgsaie/prezzi-mensili-carburanti"
    },
    {
      "label": "Apple App Store Italia — RouteBudget",
      "url": "https://apps.apple.com/it/app/routebudget/id6789717191",
      "publishedOrUpdated": "Scheda pubblica consultata il 2026-09-07; versione installata da verificare sul dispositivo",
      "geography": "Italia",
      "accessedAt": "2026-09-07",
      "supports": "Funzioni generali dichiarate di calcolo costi, scenari, Archivio e PDF. Il campione PDF separato documenta il template sorgente datato, non ogni versione corrente."
    }
  ],
  "status": "published",
  "author": "Eng. Mostafa",
  "reviewer": "Eng. Mostafa",
  "secondaryKeywords": [
    "calcolo litri carburante tratta",
    "costo gasolio viaggio camion"
  ],
  "cluster": "costo-trasporto",
  "relatedCalculator": "calcolatori:costo-chilometrico-camion",
  "appFeature": "fuel-estimate",
  "canonical": "/it/calcolatori/costo-carburante-viaggio/",
  "ogImage": "/og-cover.jpg",
  "noindex": false,
  "changeSummary": "Allineato l’esempio al calcolatore chilometrico; aggiunto confronto di variazioni isolate e congiunte, con ipotesi e arrotondamenti espliciti."
}
