{
  "slug": "calcolo-costo-trasporto",
  "kind": "pillar",
  "locale": "it",
  "title": "Calcolo del costo di trasporto: metodo completo per una tratta",
  "description": "Come stimare il costo operativo di una tratta camion includendo carburante, pedaggi, autista, usura, ritorno a vuoto e margine.",
  "eyebrow": "Guida al costo di tratta",
  "published": "2026-08-01",
  "modified": "2026-08-22",
  "reviewed": "2026-08-22",
  "primaryKeyword": "calcolo costo trasporto",
  "searchIntent": "informational",
  "topics": [
    "costo di tratta",
    "autotrasporto",
    "tariffa camion",
    "margine operativo"
  ],
  "related": [
    "guide:costi-autotrasporto",
    "guide:preventivo-trasporto",
    "guide:costo-chilometrico-camion",
    "guide:calcolare-carburante-pedaggi-autista",
    "guide:quanto-consuma-un-camion",
    "guide:calcolo-pedaggio-camion",
    "guide:pedaggio-camion-austria",
    "guide:pedaggio-camion-svizzera",
    "guide:pedaggio-camion-germania",
    "guide:pedaggio-camion-paesi-bassi",
    "guide:pedaggio-camion-belgio",
    "guide:pedaggio-camion-slovenia",
    "guide:pedaggio-camion-francia",
    "guide:costo-traghetto-camion-sardegna",
    "guide:costo-traghetto-camion-sicilia",
    "guide:eurovignette-camion-2026",
    "guide:pedaggio-camion-repubblica-ceca",
    "guide:clausola-adeguamento-carburante-autotrasporto",
    "guide:tempi-guida-riposo-camion",
    "guide:costo-orario-autista-camion",
    "guide:tempi-attesa-carico-scarico-autotrasporto",
    "guide:proteggere-margine-tratta",
    "guide:ritorno-a-vuoto-autotrasporto",
    "guide:tariffe-trazionisti",
    "calcolatori:costo-chilometrico-camion",
    "calcolatori:costo-carburante-viaggio",
    "calcolatori:fuel-surcharge-autotrasporto",
    "landing:app-per-autotrasportatori"
  ],
  "pillar": null,
  "calculatorId": null,
  "conversionIntent": "complete-trip",
  "translationGroup": "calcolo-costo-trasporto",
  "sources": [
    {
      "label": "EUR-Lex — Regolamento (CE) n. 561/2006 sui tempi di guida e riposo",
      "url": "https://eur-lex.europa.eu/legal-content/IT/TXT/?uri=CELEX:02006R0561-20241231"
    },
    {
      "label": "Commissione europea — Road charging",
      "url": "https://transport.ec.europa.eu/transport-modes/road/road-charging_en"
    },
    {
      "label": "Commissione europea — Weekly Oil Bulletin",
      "url": "https://energy.ec.europa.eu/data-and-analysis/weekly-oil-bulletin_en"
    },
    {
      "label": "MIT — Valori indicativi dei costi di esercizio, marzo 2026",
      "url": "https://www.mit.gov.it/documentazione/valori-indicativi-di-riferimento-dei-costi-di-esercizio-dellimpresa-italiana-di-6"
    }
  ],
  "status": "published",
  "author": "Eng. Mostafa",
  "reviewer": "Eng. Mostafa",
  "secondaryKeywords": [
    "prezzo tratta camion",
    "calcolo tariffa autotrasporto",
    "calcolo costo trasporto merci"
  ],
  "cluster": "costo-trasporto",
  "relatedCalculator": "calcolatori:costo-chilometrico-camion",
  "appFeature": "complete-route-calculation",
  "canonical": "/it/guide/calcolo-costo-trasporto/",
  "ogImage": "/og-cover.jpg",
  "noindex": false,
  "changeSummary": "Aggiunti percorsi contestuali al controllo Excel e al pedaggio A22 verificato, mantenendo il metodo generale distinto dagli approfondimenti specialistici."
}
