{
  "slug": "preventivo-trasporto-pdf",
  "kind": "guide",
  "locale": "it",
  "status": "published",
  "title": "Preventivo di trasporto PDF: contenuti e controllo finale",
  "description": "Apri un esempio PDF RouteBudget, controlla input e calcolo, e scopri quali campi genera l’app e quali dati completare prima dell’invio al cliente.",
  "eyebrow": "Dal calcolo al documento",
  "published": "2026-08-01",
  "modified": "2026-09-19",
  "reviewed": "2026-09-19",
  "author": "Eng. Mostafa",
  "reviewer": "Eng. Mostafa",
  "primaryKeyword": "preventivo trasporto PDF",
  "secondaryKeywords": [
    "modello preventivo autotrasporto",
    "PDF preventivo camion",
    "checklist preventivo trasporto PDF",
    "riepilogo costo tratta"
  ],
  "searchIntent": "informational-commercial",
  "conversionIntent": "pdf-quote",
  "translationGroup": "road-haulage-quote-pdf",
  "cluster": "preventivi-trasporto",
  "pillar": "guide:preventivo-trasporto",
  "related": [
    "guide:preventivo-trasporto",
    "guide:calcolo-costo-trasporto",
    "guide:errori-calcolo-tariffa-trasporto",
    "guide:proteggere-margine-tratta",
    "calcolatori:costo-chilometrico-camion"
  ],
  "relatedCalculator": "calcolatori:costo-chilometrico-camion",
  "calculatorId": null,
  "appFeature": "pdf-quote",
  "canonical": "/it/guide/preventivo-trasporto-pdf/",
  "ogImage": "/og-cover.jpg",
  "noindex": false,
  "topics": [
    "preventivo PDF",
    "controllo del PDF",
    "controllo documenti",
    "scenario di prezzo"
  ],
  "sources": [
    {
      "label": "Google Play — RouteBudget EU",
      "url": "https://play.google.com/store/apps/details?id=eu.routebudget.app",
      "publishedOrUpdated": "Scheda live consultata il 2026-08-01",
      "geography": "Disponibilità secondo paese o area dello store",
      "accessedAt": "2026-08-01",
      "supports": "Destinazione ufficiale Android e disponibilità del prodotto; le funzioni restano quelle dichiarate nella pagina."
    },
    {
      "label": "Apple App Store Italia — RouteBudget",
      "url": "https://apps.apple.com/it/app/routebudget/id6789717191",
      "publishedOrUpdated": "Scheda pubblica consultata il 2026-09-07; versione installata da verificare sul dispositivo",
      "geography": "Italia",
      "accessedAt": "2026-09-07",
      "supports": "Funzioni generali dichiarate di calcolo costi, scenari, Archivio e PDF. Il campione PDF separato documenta il template sorgente datato, non ogni versione corrente."
    }
  ],
  "changeSummary": "Aggiunta riconciliazione fra costo completo, prezzo e documento; distinto l’esempio web dal PDF dimostrativo e ridotta la checklist duplicata."
}
